{
  "$schema": "https://design-wiki.dev/schemas/registry-item.json",
  "name": "minimal-table",
  "type": "registry:component",
  "title": "Minimal Table",
  "description": "Clean tabular data display with accessible headers, captions, and responsive overflow.",
  "category": "ui:editorial",
  "tags": [
    "table",
    "data-grid",
    "accessible",
    "editorial"
  ],
  "dials": {
    "design_variance": 3,
    "motion_intensity": 1,
    "visual_density": 9
  },
  "a11y": {
    "keyboard_navigable": true,
    "wai_aria_compliant": true,
    "wai_aria_role": "table",
    "fallback_provided": true
  },
  "license_origin": {
    "source_repository": "https://diagram.com",
    "license_type": "MIT",
    "author": "diagram-design team",
    "attribution_required": true,
    "redistribution_mode": "full_source"
  },
  "dependencies": [
    "clsx",
    "tailwind-merge"
  ],
  "registryDependencies": [],
  "files": [
    {
      "path": "registry/editorial/minimal-table.tsx",
      "content": "/**\n * @license MIT\n * @origin diagram-design (https://diagram.com)\n * @author diagram-design team\n * @curated-by Machine-First Design Agent Wiki\n * Maintained under upstream open-source license terms.\n */\n\nimport * as React from \"react\";\nimport { cn } from \"../lib/utils\";\n\nexport interface Column<T> {\n  key: keyof T | string;\n  header: string;\n  render?: (item: T) => React.ReactNode;\n}\n\nexport interface MinimalTableProps<T> {\n  data: T[];\n  columns: Column<T>[];\n  caption?: string;\n  className?: string;\n}\n\nexport function MinimalTable<T extends Record<string, any>>({\n  data,\n  columns,\n  caption,\n  className,\n}: MinimalTableProps<T>) {\n  return (\n    <div className={cn(\"w-full overflow-x-auto rounded-xl border border-border bg-card\", className)}>\n      <table className=\"w-full text-left text-sm\">\n        {caption && (\n          <caption className=\"p-4 text-xs font-medium text-muted-foreground text-left\">\n            {caption}\n          </caption>\n        )}\n        <thead className=\"border-b border-border bg-muted/40 text-xs font-semibold uppercase text-muted-foreground\">\n          <tr>\n            {columns.map((col, idx) => (\n              <th key={idx} scope=\"col\" className=\"px-6 py-3\">\n                {col.header}\n              </th>\n            ))}\n          </tr>\n        </thead>\n        <tbody className=\"divide-y divide-border\">\n          {data.map((row, rowIdx) => (\n            <tr\n              key={rowIdx}\n              className=\"transition-colors hover:bg-muted/20 focus-within:bg-muted/30\"\n            >\n              {columns.map((col, colIdx) => (\n                <td key={colIdx} className=\"px-6 py-4 font-normal text-foreground\">\n                  {col.render ? col.render(row) : row[col.key as keyof T]}\n                </td>\n              ))}\n            </tr>\n          ))}\n        </tbody>\n      </table>\n    </div>\n  );\n}\n",
      "type": "registry:component",
      "target": "components/ui/minimal-table.tsx"
    }
  ]
}